{
  "name": "tag",
  "version": "3.1.0",
  "description": "Central de tags administrativas: CRUD, lixeira/restore/purge e contagem de uso agregada de consumidores registrados.",
  "kernelRange": ">=4.0.0 <5.0.0",
  "dependsOn": [{ "name": "identity", "range": ">=3.0.0 <4.0.0" }],
  "apiModule": { "export": "TagModule", "path": "modules/tag/tag.module" },
  "schemaExports": [
    "modules/tag/infrastructure/tables/tag.schema",
    "modules/tag/infrastructure/tables/tag.table"
  ],
  "customMigrations": ["01_audit_attach_tags.sql"],
  "env": [],
  "absorbs": []
}
