{
  "name": "attachment",
  "version": "2.0.1",
  "description": "Upload, download e log de acesso de anexos, com perfis de upload genéricos (avatar, access-link-avatar, document, image, multi).",
  "kernelRange": ">=2.0.0 <3.0.0",
  "dependsOn": [
    { "name": "identity", "range": ">=2.0.0 <3.0.0" },
    { "name": "notification", "range": ">=2.0.0 <3.0.0" }
  ],
  "apiModule": {
    "export": "AttachmentModule",
    "path": "modules/attachment/attachment.module"
  },
  "schemaExports": [
    "modules/attachment/infrastructure/tables/attachment.schema",
    "modules/attachment/infrastructure/tables/attachment.table",
    "modules/attachment/infrastructure/tables/attachment-acl.table",
    "modules/attachment/infrastructure/tables/attachment-access-log.table"
  ],
  "customMigrations": ["01_generic_upload_profiles.sql"],
  "env": [
    {
      "name": "ATTACHMENT_MAX_UPLOAD_BYTES",
      "example": "5242880",
      "required": false,
      "doc": "Tamanho máximo, em bytes, de um único arquivo enviado."
    },
    {
      "name": "ATTACHMENT_ACCESS_LOG_RETENTION_DAYS",
      "example": "180",
      "required": false,
      "doc": "Dias de retenção das entradas do log de acesso a anexos antes da purga."
    },
    {
      "name": "ATTACHMENT_MULTI_MAX_FILE_BYTES",
      "example": "524288000",
      "required": false,
      "doc": "Tamanho máximo, em bytes, de um arquivo dentro do perfil de upload multi."
    },
    {
      "name": "ATTACHMENT_MULTI_MAX_TOTAL_BYTES",
      "example": "524288000",
      "required": false,
      "doc": "Tamanho máximo, em bytes, do lote inteiro de arquivos do perfil de upload multi."
    },
    {
      "name": "ATTACHMENT_PENDING_QUOTA_BYTES",
      "example": "2147483648",
      "required": false,
      "doc": "Teto de bytes pendentes (ainda não confirmados) por dono — cota contra esgotar o storage com uploads nunca finalizados."
    },
    {
      "name": "ATTACHMENT_MAX_CONCURRENT_UPLOADS",
      "example": "16",
      "required": false,
      "doc": "Uploads em voo, na instância — teto de memória/handles concorrentes."
    }
  ],
  "absorbs": []
}
